id,name,price,dist_to_coast,X,Y
641626442542109400,Manly harbour view Eastern Hill appartment,460,6.620210228189504,341083.010613461,6258061.518402999
775552,Balmoral beach Garden Oasis  Mosman,190,457.3031326550034,337728.13601621176,6255830.814308081
71866,A Jewel Amongst Greenery,200,1124.446322272656,338380.36863631476,6246603.876385539
86853,Bondi Beach Break 2 Bedroom Apt,290,662.719765841457,339776.6144152783,6248213.804559801
103273,Hastings Family Hideaway—Footsteps to Bondi Beach,340,123.07260472182244,341337.6303641048,6248740.333187299
787970,Beach to home in 3 minutes: Bondi N,240,241.41455143954394,341168.8092123745,6248821.769235361
287388,Your own little Sydney terrace close to everything,340,2845.895144499616,333535.2419721959,6247471.934525672
290146,"Bellevue Hill Designer, Beaches, City and Views",300,1527.0803817222366,338867.5864658522,6249123.560985038
1181214,Huge amazing art-filled Annandale warehouse,330,1518.5945326656738,330920.8122534089,6249003.269317901
1184688,Manly - Gorgeous Large Art Deco Apartment,330,335.7115588045264,340934.8831587675,6259169.400891168
1188276,Spacious and bright art deco close to the  beach,210,908.4679063626597,339997.15462525905,6249124.903558592
1218594,BONDI HAVEN- CHIC 2 BEDROOM APARTMENT,200,852.9152292099835,340012.94231290347,6249066.378288471
813853,Perfect Position on Queen Street,240,1560.9868257311452,337246.7162021068,6248908.462774594
822347,STUNNING City Loft Warehouse Apt,640,1875.0233033459938,333110.91993085615,6248351.936918227
1257706,Newly-renovated Designer Beach apartment,300,633.4581381133252,340800.6198213409,6249208.284730107
1321338,Boutique Penthouse Style Apartment with Deck Walkout,510,1843.935343449499,338484.1855267682,6248384.927605322
386997,Beautiful 2 Bedroom Apt Min Walk to the City,250,1491.214858993244,333354.03800548683,6248889.784009298
405375,Stanmore whole home - 2 large dble bedrooms,440,2531.332418377157,330399.3035046621,6248098.678224783
866422,"Studio Apartment@Manly Beach,Sydney",170,198.37426732426712,341352.21367567923,6259134.204135748
408330,Bondi Beach -  Beachfront Stunner,390,338.2844446523253,340549.2804520506,6248804.734868586
869528,Fabulous 2-bed apt in Potts Point,790,514.8841930713185,335710.81533878145,6250470.533290597
871059,Apartment on Balmoral Beach Hill,240,722.0512395411308,337461.24981385574,6256171.245767275
472566,Manly Sunshine Cottage - quiet family retreat,180,1323.9643987900747,340262.19028684706,6260406.055372575
1484520,"Comfortable Apartment in a Character Building, Best Location",540,142.79176818822685,332612.6636396647,6254743.890539782
934543,"Private, quiet, boutique home 2 BR",140,705.6564470985007,340724.5285119437,6259509.7544752285
1018623,Designer Warehouse Apartment Sydney (walk to city),1100,397.2603638395106,336117.40193640767,6250072.661553898
1606341,THE BEACH PAD @ BONDI BEACH,260,281.93386361950326,340711.80990327056,6248821.882013349
725235,Harbourside Apartment in Sydney,570,29.73824305867963,332127.94787068653,6253394.750950662
1713966,Bondi Executive Penthouse with Parking and AC,310,984.0458504560896,339582.687050004,6248741.871691396
1131054,Executive Luxury design Apartment,620,1624.301765430115,336951.51928238466,6248751.4284825325
765765,Beachside Love Shack Bronte,330,144.88161892819542,339808.54329255957,6247034.079044493
1818516,Charming sandstone and timber house,400,428.65758667628563,331269.0992477698,6251422.170511188
2077065,"Enjoy Ocean Views, Balcony, Garage, Two Min Walk to Beach",260,199.73803614930878,341458.9756902475,6260527.742844509
1837068,Relaxing Holidays on Balmoral Beach,350,118.27139837244673,338272.87848868093,6255481.788837149
1852715,Quiet Oasis in Darlinghurst,420,689.1219322749575,335763.43525786244,6250033.1613522675
2089480,Sand Sun Surf for 4. City just 9km,180,228.80750995746294,338801.64070622344,6242442.355980983
1808700,Luxury waterfront & amazing views,2300,18.103124790880198,335095.6149820108,6252864.829191463
1893048,Lovely 2 br Bondi Beach Apartment,250,1006.5036652370385,340066.43828279956,6249295.78791458
2132102,Highly Recommended Bondi apartment,210,280.23440939650783,340372.8997345042,6248620.96236643
2694037,Kookaburra Beach House Apartment Close to Coogee Beach,490,525.6888796874803,338443.4625219089,6245288.232278656
2197550,Harbourside Apartment,1000,12.095041301661867,336106.8185052215,6250901.118286368
2218225,Cowper Apartment -Randwick Close to Beach City,340,2203.977758597873,337190.11361037823,6246652.312002131
1968430,Nth Bondi 2BD Serene & Child friendly + Pool,370,463.4431982904754,340949.03861307126,6249295.074386524
1979812,THE BEACH RETREAT,330,403.0888144331651,338570.61053689726,6244881.0709695555
2238586,Townhouse in the Trees,560,165.01237224720046,332935.0492761408,6252200.371362567
1989968,Spacious comfortable 2 bedroom. Handy location.,240,2272.5515069365406,337067.91416204965,6246497.133296903
2291780,Stunning apartment-Full city views!,290,3463.9461393173074,331898.10256424604,6246732.01603372
2827438,Split level 2-bedroom apartment w/ carspace,150,3768.440543890149,334520.66266557627,6246765.89184474
2832968,2b sun soaked Bondi beachfront apt,270,149.68862880640097,341281.6642554125,6248600.694326639
2392859,Renovated Historic Sandstone Home with Plunge Pool,450,684.7879641525503,340291.31670527044,6259386.036405602
2022235,Your Sydney Home Away From Home,490,147.81275732271467,336080.3249747708,6253834.723977452
2027798,Quiet and convenient with parking near Central,160,1238.05575368725,333245.42036144866,6249121.942582771
2890011,The Beautiful Bungalow,290,4155.724348604032,329353.85067971033,6245839.084097771
2407046,"Sunny Loft Lookout with Opera House, Bridge & City Views",950,112.92199277718696,335697.09083081794,6251050.455593629
2438152,Large flat - steps from Bondi Beach,720,218.2872727629746,341261.66001966107,6248912.062012251
2062003,Inner West Sydney Townhouse,230,174.39389461402516,330205.1069423255,6251564.081610451
3115490,Kookaburra Grand 2 bed apt air-cond with garden,550,525.7623255684866,338443.35552873113,6245288.0982961245
2511345,Quiet Beach House,460,769.0997485622082,339731.1603430322,6248550.255703349
2546323,beautiful private  garden studio in sydney,120,236.9387226363495,334813.08174454723,6258754.908849739
2547558,Sweeping City Views from an Elegant Apartment,420,1239.216213819254,331324.7239042354,6249226.701620651
3220450,Hear Native Birdsong from a Sunny Inner-City Sanctuary,270,2700.2536599254554,330923.4698064525,6247807.396263557
4236007,Manly Beach House,270,466.51918705847845,341035.2087363804,6259731.39746478
3273191,2BR Apt-CBD/Anzac Bridge/Mtn. Views,210,1471.9490599687897,330560.43406340404,6249178.712897519
4251796,Ultimate Bondi Escape+  Balcony+  Stunning Views!,660,62.81226462719121,340449.4552611826,6247863.510861569
4252825,City Fringe Apartment,290,1908.9911061668724,334123.51958070195,6248585.989706473
3335117,Inner City Executive Town House in Garden Oasis,570,1114.9103027795998,334998.0422240214,6249901.319271685
3988362,"The Sanctuary, Private Garden Apartment at Bondi Beach",460,377.97583850952606,340088.1647597202,6248389.882565155
4008182,The Copper House,360,584.0323525646576,338698.5617259046,6246057.976516567
3407081,Breathtaking Ocean Views,730,20.088495565978196,340490.8080147413,6247879.735273596
3443845,sunny bondi beach top floor views,180,558.8362332456336,339881.39517751423,6248198.93259944
3489739,Contemporary Top Floor Apartment,270,2822.160758287573,334925.89820167737,6247929.949778013
3499364,Apartment Two,500,1113.8391144191041,335087.39683210774,6249870.700701123
3518136,Stunning Manly Beach views - 906 Manly National,140,193.95343829104868,341365.72902573127,6259101.151820466
4144932,Sydney City Central StudioApartment,320,1016.6346490330099,334538.4296964798,6249941.027813798
4145041,Hyde Park Plaza Apartment,310,1011.5079594672887,334565.1363089654,6250001.394989947
4379780,Prime Beachfront Apartment Manly Beach,550,186.58198500289598,341606.26303132065,6258670.329463764
4380558,Modern spacious inner city apt,360,786.989215256819,330279.79521448864,6250542.615685701
4387602,Convenient Kings Cross Apartment,220,735.0571961641123,335519.4521203664,6250193.228195662
4483704,Bright and beautiful in the heart of Balgowlah,110,1061.7570100519374,339239.5533798203,6259916.330298131
4493839,"Stylish, comfortable, beachside residence",210,284.95434644403514,339050.2607202654,6246097.225803921
4753664,Ideal for quarantine // easy living,120,2913.319580267367,336027.609349706,6245146.952248705
4766592,The Dome Seaforth near Manly,600,229.42866222084464,336973.22273409413,6259695.9319169
4771018,2 Bedroom Bondi Penthouse,230,276.6698502601829,340325.57344057737,6248574.687032413
4561042,Harbour Front Accommodation,2500,134.70912339173765,333282.6107549498,6250852.007646957
4958261,Rooms with a view in Rozelle Sydney,240,406.0163137743478,330331.3420940205,6251335.595195329
4615956,Beach Front Bliss,610,73.45022017251583,341467.09180556465,6259192.9083950855
4624812,2 large bedrooms. Amazing location,130,207.5686909448336,341675.04321895255,6258599.3716281485
5043008,"Studio (balcony)@Manly Beach,Sydney#",140,188.98206299089267,341349.43923024466,6259189.620018458
5052611,"Luxury close to City,Bondi Beach in Bondi Junction",420,1813.0577821982201,337755.5748559863,6248635.409459969
4883406,2 Bedroom Apartmnt Heart Of CBD FREE PARKING SPACE,600,916.526983727056,334446.123600474,6249981.5736562405
4674109,Redfern Cool  2 Bed Retreat,250,2454.490072706211,334523.32152586,6248152.569486448
4688422,Manly - Ocean & Harbour Beaches,210,101.5853593161971,341192.9512937962,6258076.662141439
5672994,"Home away from home, great location",240,3095.035988992488,332490.15377298876,6247041.997915942
6020591,SEA BREEZE @ Bondi Beach,220,198.039412060212,340160.9618901821,6247802.086753033
6174915,2bdr urban pad Art Deco amongst it all,270,1382.9537341939717,335060.6641874556,6249598.4588444475
5826286,OCEAN COVE - hosted by: L'Abode Accommodation,360,202.94131269648304,339425.1139626384,6246134.635138017
5551123,Modern Resort Style Living,830,302.5696733465367,336148.11273071833,6250169.699306815
5560772,Modern Studio Glebe Forest Lodge,260,886.5016399484181,331704.4033330808,6249625.024675053
5887408,"Historic cottage, walkable creative area, parkview",330,2225.59744865261,331844.74900959723,6248021.213530711
5606539,Manly Beach Hideaway in Sydney,150,314.54704598911854,341224.70890662575,6259172.01401086
6661036,PYRMONT Harris St -Long/Short term avail: L'Abode.,520,319.06067765182706,333058.3170753556,6250767.091838176
6485882,Sydney Inner West 1-2 BR Apartment near bus/train,120,2920.4044820883382,329746.74563084636,6247654.361610077
7118281,Sunny deco apartment close to beach,270,792.303187135582,338535.83678016474,6246218.2738261055
6518631,Art Deco Family Apartment on Manly Beach,180,318.9600026786439,341192.133748068,6259960.142044624
7211024,Apartment on water's edge,240,161.98288056254222,341973.24335302715,6258486.741262691
7224525,Quiet Oasis on the Cusp of Surry Hills,250,2980.3567042280665,334654.3923768499,6247637.916875895
6896098,Entire Modern Apartment Chatswood,320,2732.3529341855774,331882.27715856594,6259202.63060719
6925526,Stylish and Spacious Apartment Next to Beach with Garage,490,478.39130644293675,338583.96829502867,6245509.152301211
6939964,LOVELY BALMAIN TERRACE NEAR FERRY,440,338.7517361267491,331953.5573218385,6252227.452056421
6626617,Stunning Apartment at Bondi Beach,550,853.0381176685261,340179.30871568527,6249185.651404698
7353616,Large SunnyTerrace by Queens Park& Centennial Park,370,1586.4476293132468,338100.05864412175,6246987.348676561
7536161,"2 bedroom apartment with water views, Manly",360,296.60431041198814,340286.7090409775,6258997.722507365
7027195,Harbourside Accommodation Unit 907,1700,30.60734311271318,333412.9746161765,6250805.483564289
7921725,Delightful semi dynamic Inner West,410,270.4581420366652,331148.65274406533,6250231.949039407
7581942,Sydney Neutral Bay 2BR Garden Unit,190,468.160820989596,335829.1053589694,6254768.847929917
7638582,Sunny two bedroom beach apartment in Manly,140,319.30952374930405,341701.09369335906,6258374.628590697
8317223,Lane Cove Harbourview House,160,138.53106557620833,328686.55842157477,6255413.963432122
8020784,Relax in a Luxe Open-Plan Beachfront Apartment,360,42.92940686954825,341618.4732341608,6260276.710312772
8193171,"A1 Fantastic Apartment, Minutes from City Parking Included",520,1103.3173408743057,334876.5251745141,6249972.422286188
8723030,Designer Apartment in Bondi Beach,230,1133.536009307983,339390.390488232,6248679.830955727
8474401,Stunning Unit City Harbour Views + Parking +BBQ,1100,594.7120130256048,335102.96642055066,6250429.168917479
8245430,Elegant Apartment with Bridge and Opera House Views,530,876.64099226522535,335419.1979628897,6250051.721505125
8741100,Stylish Watsons Bay flat close to harbour beaches,390,8.372734551308012,341000.0350416822,6253659.743417515
8747750,Beautiful art deco 2 bd apt close to the beach,260,665.9720689269378,340116.42137099867,6248909.495239348
8974359,Camelot Hall: Art Deco Potts Point Penthouse,660,163.23415348714275,335724.2189620218,6250996.0144979935
8977284,"Cozy loft-style studioCentral,Broadway,Darling hbr",180,1113.0183393076477,333101.9540825004,6249178.2168812
8596993,Beautiful Bondi Junction Terrace,330,2057.746555002869,338111.1362113845,6248182.233901453
9164562,"Yes, it's true! Freshwater, 2 mins from beach #1",210,480.1230790251077,341453.0001833652,6261149.149329942
9097525,Manly Vale Sunny Apartment,160,1411.965349946485,340152.282552121,6260332.11282233
9097988,Bondi Beach Surf Side Apartment,350,161.40254420988063,340314.80016705533,6247949.988901028
9240361,Expansive Harbour Views,1000,56.14670456971407,336085.28639933304,6250861.9219239205
9496810,Bondi's Best Kept Secret - Fun space-hear the surf,330,224.85186353497517,340271.6959478669,6248422.920965338
9302572,Harbour View,330,290.5206720405607,340083.35717091453,6259029.809181412
9315724,"Stylish, Modern Retreat in Central Sydney with Car Space",300,325.30908698440095,336030.11712426005,6250305.216282994
9599285,Sydney Haven - private sanctuary - 15 mins to CBD,360,591.0331798304362,330957.9762879241,6251588.589042204
9563497,Modern Beachside Family Apartment - Freshwater,270,386.31084676050637,341317.5560769246,6260827.436637247
9615165,Stylish parkside retreat,290,2348.1103045420496,337139.50588592386,6246906.580405386
9801139,Balmoral Beach escape,430,74.28648567208838,338170.4013763087,6255683.043507479
9810515,"Big 2bdm, Views, WIFI and carpark",660,239.84222400631506,335414.57368161477,6250692.813448947
9685977,Darling Harbour Getaway,2300,109.63529326003001,333330.2359736984,6250716.508930523
9830174,2 Level Skyhome Near Beach/Hospital,420,1495.4804180323952,337457.790781743,6245280.272074832
10042868,The Beach Pad Bondi Beach,340,425.78576548877544,340509.115403873,6248882.81835974
10047153,Sydney-style studio unit,100,2948.7094315437153,333047.3398513986,6247232.630901031
9979246,Surfside Swell,460,300.78990416349313,339700.4178959141,6246919.10817626
10273575,Executive Coastal Living,410,330.78041779751135,338763.3096743467,6244642.5244673295
10302621,"Comfortable Home, Pet friendly",230,1833.9287917156214,329041.11767357355,6242972.45019009
10839366,"Harbour Icons on display, Firework Extravaganza!",380,178.90136031479807,336577.8836687788,6254182.721765777
10575238,A Provincial Abode in Woollahra,400,1197.736305382047,337032.1244400802,6249229.804695262
10388137,"Breathtaking views, treetop seclusion",520,407.02176913861746,340071.6278235812,6248053.495903214
10656719,"New Y Style Apartment, near Restaurants, Theater & Transport",420,1937.5696301536411,332301.120219729,6248213.429937569
11023378,Vintage Suite to Opera House （2 bedrooms ）,1200,410.88413727763907,334164.7534061588,6251472.006539749
11148586,2Br 2Ba Oasis in trendy Erko,290,3270.225209979405,332140.4135827896,6246890.499550451
11047921,MOSMAN Muston St Long/Short term lets L'Abode,240,722.589506228183,337720.64511996985,6255183.982010242
11181299,Beautiful modern historic home near Sydney harbour,590,180.9755380636978,334690.1921012008,6254092.436066482
11063067,Mini Manhattan: Potts Point Harbourview Retreat,360,272.38897157633005,335823.06918095355,6250828.555324614
11209774,Beautiful One Darling Harbour Apt,1300,66.64914101000687,333402.13075667154,6250632.241679585
10751047,Lovely renovated inner city terrace close to CBD.,170,2891.484167321695,332906.10063510045,6247268.97234108
11111400,"Top floor apartment, city views",630,578.6916109700327,333632.2357686394,6254512.172923097
11302154,2 Bedroom Apartment on  Oxford,240,1287.8147163854019,334991.02569907904,6249719.272586014
11572238,Bondi Vista Beachfront Apartment,620,123.44418389288712,341215.13119852263,6248651.7175908545
11404309,EIGHT TWO NINE TWO III: BONDI BEACH,360,293.315707989241,340382.6627827578,6248645.530268062
11462172,Camperdown Two Bedroom Apartment Near Uni/Hospital,470,1371.2900354158714,331625.67159016384,6249107.795746459
12115369,Stylish Bondi Apartment with Sweeping Ocean Views,540,79.78587299014684,340402.626089256,6248008.037867453
12070028,Blackwattle Bay Apartment,450,139.04894382324164,332077.27689433855,6250410.361664904
11779581,Bright Spacious Unit near Manly,170,1205.4752385051606,339476.24957225216,6260105.562906228
12575244,Sunny Manly Art Deco Apt: 2 bedroom + Sunroom,350,256.22039857885414,341646.42242171324,6258426.963888399
12655535,"Thriving city location, dining hub",710,295.54310466163133,333173.9170216789,6250507.324517643
12939941,Oxford St Central Terrace,380,1399.3562869930838,335282.7400784383,6249490.272149678
12232424,"Perfectly located, large 2 bed apartment",830,2030.0643235621608,333444.4967584145,6248321.185007874
12292155,"Bright, Spacious Apartment Close to Bondi Beach",520,705.6390082801386,340004.37431956,6248861.019561902
13020425,Hyde Park View 2 bedroom Apartment - Sydney CBD,570,1080.851865598301,334681.83552363515,6250101.044124868
12352629,Stylish Boutique Apartment with Breathtaking Views,460,139.4671560578664,336095.45306776906,6253923.727257486
12832768,"Pool and Outdoor Living Waterfront Duplex, Own Entrance",890,44.52084736073564,332541.62697333447,6254414.286620907
12874761,Terrific 2 Bdrm Greenwich Peninsula close to City,430,59.409549217959245,332139.50276183436,6254382.798193903
13081969,Stroll to Bronte Beach from an Apartment with Ocean Views,530,218.37660160175696,339849.4104693328,6246859.50360008
13129354,Sydney CBD: Pitt st 2 Bedroom apartment + balcony,680,687.9697228604905,334129.3220644414,6249949.426219733
13607553,Sunny north shore apartment with garden outlook,160,4464.151050132084,329273.2574511772,6262617.330819868
13163379,The Junction Palais - with 400Mbps  5G WIFI!,450,1717.700516506489,338550.16477433476,6248258.4824407995
13163389,New York on Riley,560,895.030403688679,334835.7488633327,6250242.382501813
13180624,Haven on High,560,73.59712002940893,334842.10253360803,6253926.461320339
13361446,Darling Hbr Tranquil Garden View Huge Apt with Spa,470,221.04073326742952,332589.8306643839,6250939.670609543
13182046,Sydney Kent st 2 Bedroom pet friendly apartment,1100,391.6279989320041,334000.6756482279,6251276.124895925
13380071,Bondi Beach & oceanview apartment,240,263.03457730203576,340178.2867502445,6248201.714750852
13719567,THE SYDNEY HARBOUR VIEW APARTMENT,670,91.27824196435219,336215.8275584177,6253598.561320508
13787685,Sydney CBD 2 Bedroom Apt with View of Mardi Gras,500,1086.2472744954011,334682.1055917883,6250085.51863089
13437477,Absolute view of Darling Harbour and Cockle Bay,2700,25.291048984862037,333418.6609958991,6250797.818067611
13900213,"Bondi Beach Pad - Sunny, Spacious, Ocean Views",160,437.03479671465465,340832.56090476515,6249013.589833951
13515422,Spacious Art Deco apartment in Darlinghurst,310,1035.5395721937327,335386.757352624,6249894.74904762
14749842,RESORT STYLE STUDIOS  GYM- HEATED SPA- PLUNGE POOL,140,222.42099477835254,341334.13989139383,6259107.281536967
14377982,Panoramic views in luxurious brand new apartment,590,2653.091625828747,329401.8647770145,6244249.149152048
14391952,"Chill out in a Cosy, Stylish & Light Apartment",280,245.79786264812273,341274.7651042427,6259280.444015414
14826773,SYDNEY CBD City Centre 2 bedrooms Perfect Location,370,219.98222778044203,333881.8715266448,6250925.728749211
14857702,"Luxury, Views & Sophisticated Large Studio",570,16.999640421204266,336214.7094803437,6250815.34401066
14886923,"Large Studio with Harbour glimpses, City Fringe",340,988.3865717415346,334711.2213255438,6250220.250253376
14890287,Studio with balcony by Hyde Park,360,1126.153333851289,334760.1132010097,6250015.880131582
14188076,Beachside lookout close to Bondi Beach,400,67.50441937085633,340532.4035261957,6247716.26249974
14543384,Sydney Park View 2 Bedroom Pet Friendly Apartment,520,1085.1267285952765,334771.4245088479,6250057.120859372
14939185,Sydney Oxford st view 2 Bedroom Apartment +Balcony,480,979.4973220158538,334728.854100093,6250217.228997453
15013882,Luxurious Harbourview CBD 2 Bedroom,1000,236.4551973916979,333912.55375892797,6250917.3904277105
15380232,Ocean Vistas: Bright Art Deco Beach Pad at Bondi,230,1082.7636382327346,339178.07386958855,6248062.92142036
15452932,Bondi Beach Pad only 50 Metres from the Ocean,250,384.2786991546968,340572.20952697034,6248871.675545109
15138240,Beautiful 2 bedroom house in fabulous Newtown,320,3456.040119379368,331559.831468883,6246821.421869952
15148666,Sweeping Ocean Views - Bondi Beach 2 bed + parking,550,125.08808104305675,340355.40743184753,6248010.572024144
15484710,Bondi Dream,150,244.14007180035424,340735.47002209775,6248790.110097098
15524611,"Sun-filled, Cosy 2 Bdr Apart 2 min from the beach",270,143.554914383862,341342.89935190155,6248866.830282523
15535508,"Charming Paddington, Close to City Sydney CBD & Bondi Beach",360,1392.435097670763,335329.7357560546,6249447.824172001
15891870,"WATERFRONT, LOCATION & FIREWORKS",730,20.323941342320392,341365.48711117473,6258392.342319129
15757595,"Bangaroo Court, North Balgowlah",74,1394.971283618591,338262.03187912825,6259994.086765204
15758309,Spacious & Convenient Modern Newtown Townhouse,330,2060.819762232038,332051.8302424217,6248133.591233326
15806964,Bondi Beach Spacious Studio With Ocean View,520,18.68799188303437,340426.0274906786,6248266.890082361
15822230,Perfect 2 bedroom apartment in best location,270,980.5403747518969,337421.0586588591,6255163.340711676
15825979,"""Hedgehog"" studio with balcony, Free Parking",270,454.86118339730365,335952.82587985264,6250172.98620468
16133658,Quiet and peaceful split level apartment,260,882.5552119448963,333008.92993063846,6255479.661802455
16192197,Waterfront Apartment Brimming with Inspirational Artwork,1100,33.417663394801,337682.5354762583,6250420.104062507
16006838,Heritage Terrace in a Waterfront Suburb Close to Everything.,250,371.87930364365945,332087.00646140025,6252060.084196957
16017289,Woollahra Sanctuary,360,1668.6576467183065,338086.1306043264,6248835.173667132
16259821,Walk to Manly & Freshwater Beach from a Cliff-Top Oasis,390,217.03435796983104,341442.37524794624,6260679.432490107
16277154,"Mabel Cottage modern 2bdm in Balgowlah, Manly area",140,1125.8425877791826,337869.9977369724,6259845.443729827
16278130,Tropical Manly beach 2bed apartment no stairs,190,101.7994046071069,341496.56220018386,6258473.279328944
16059780,Garden Oasis Apartment by Bondi Beach,260,963.3478212058058,340183.6003354854,6249315.507671738
16232184,Bronte Beach Peaceful Escape,340,769.2191782846589,339155.3687622155,6247262.638814959
16077913,LUXURY INNER CITY FAMILY TERRACE BY THE PARK,350,3746.5984766884785,330707.5677927391,6245649.22800689
16233200,Bright and spacious unit in the heart of Newtown,510,2519.2295992489994,331762.78900489735,6247739.103404179
16326370,Quiet location yet only 5 minutes from everything,660,689.2596445741492,333234.30715381174,6254927.852717144
16349467,Great Balcony Apartment Sydney CBD –City View,460,1987.9645952594062,333480.3422956343,6248387.2628302
16587005,Bright Sunny Water Views CBD Two Bedroom,920,235.75493016027443,333912.5731338423,6250916.281463198
16380801,2 Bedroom Sunny Garden Flat with access to pool.,90,1139.0271412773766,338417.21971674217,6259690.562381471
16606452,❤️Leichhardt Centre Stylish 2BedApt+Patio🅿️ Pets✓,190,1610.308360598085,329771.2842377634,6249072.531590821
16442255,Bondi Beach Pad,150,884.9923546175722,339492.05624072463,6248138.00638517
16617838,Spectacular City Apartment with Magnificent Views,390,109.09849316200525,336205.1949109973,6250723.109139236
16861128,Sunny Bondi Beach Apartment,230,396.9082599163803,340252.7215040793,6248671.07752493
16521162,Loft style  beach & city last minute!! Relaxation,170,979.5438655633446,338025.2739303013,6242430.230608474
16708536,Manly Apartment 100m from Wharf,440,239.2246713622621,341225.9233244419,6258987.900058487
17288692,Roscoe St,230,814.9877893474822,340046.61083689705,6249044.759881324
17107778,MOSMAN - lovely art apartment.,230,478.4809967558575,336778.4289078581,6254957.111638153
17347940,Funky Wiggles ICC Darling Harbour Sydney Lyric,450,207.90108522726823,333034.7229503343,6250898.685213983
17351129,Stylish 2 bedroom townhouse in Surry Hills Sydney,620,1982.0820126948033,334589.61472014175,6248701.719942531
17423339,Aqua Spectacular -  Hotelesque Home Hotel Living,670,2010.6437052995102,338376.5503867867,6248567.236862931
17495119,Spectacular Penthouse Apartment,280,1464.0313397631367,338022.9099499205,6246684.3075878685
17575549,Beautifull 2 bedroom apartment near Manly Beach,160,103.25476103598628,341551.2256441044,6260644.969357755
17610318,Balgowlah 2 bedroom Grd Flr Garden Flat,300,56.851597114051664,339614.26539228647,6258948.717490088
18180991,Edward’s Coastal Escape,380,486.2044375257512,339952.612319223,6248254.487162365
